[
  {
    "fixture_id": "real_001",
    "description": "Studio turntable scan of a sneaker — full orbit, clean background, ML masking active",
    "session_id": "cap_a1b2c3d4",
    "product_type": "sneaker",
    "capture_environment": "turntable",
    "label": "good",
    "expected_action": "accept",
    "observed_issue_classes": ["none"],
    "source": "real",
    "coverage_report": {
      "num_frames": 52,
      "readable_frames": 51,
      "unique_views": 11,
      "diversity": "sufficient",
      "top_down_captured": true,
      "center_x_span": 0.24,
      "center_y_span": 0.19,
      "scale_variation": 1.42,
      "aspect_variation": 0.23,
      "coverage_score": 0.94,
      "fallback_frames": 0,
      "low_confidence_frames": 0,
      "overall_status": "sufficient",
      "recommended_action": "reconstruct",
      "reasons": []
    },
    "validation_report": {
      "final_decision": "pass",
      "contamination_score": 0.04,
      "mobile_performance_grade": "A",
      "poly_count": 18500,
      "component_count": 1,
      "largest_component_share": 0.98
    },
    "notes": "Ideal capture. Reference fixture for performance baseline.",
    "operator_id": "op_admin",
    "labeled_at": "2026-04-13T00:00:00Z"
  },
  {
    "fixture_id": "real_002",
    "description": "Handheld scan of a leather bag — operator stopped orbit halfway",
    "session_id": "cap_e5f6g7h8",
    "product_type": "bag",
    "capture_environment": "handheld",
    "label": "recapture",
    "expected_action": "recapture",
    "observed_issue_classes": ["low_diversity", "narrow_motion"],
    "source": "real",
    "coverage_report": {
      "num_frames": 38,
      "readable_frames": 35,
      "unique_views": 4,
      "diversity": "insufficient",
      "top_down_captured": false,
      "center_x_span": 0.06,
      "center_y_span": 0.05,
      "scale_variation": 1.07,
      "aspect_variation": 0.08,
      "coverage_score": 0.29,
      "fallback_frames": 3,
      "low_confidence_frames": 2,
      "overall_status": "insufficient",
      "recommended_action": "needs_recapture",
      "reasons": [
        "Insufficient viewpoint diversity (4/5 unique views).",
        "Object motion across accepted views is too narrow."
      ]
    },
    "validation_report": null,
    "notes": "Operator only circled front half. System correctly rejected.",
    "operator_id": "op_admin",
    "labeled_at": "2026-04-13T00:00:00Z"
  },
  {
    "fixture_id": "real_003",
    "description": "Office scan of a bottle — cluttered desk background, ML fallback active",
    "session_id": "cap_i9j0k1l2",
    "product_type": "bottle",
    "capture_environment": "office",
    "label": "noisy",
    "expected_action": "recapture",
    "observed_issue_classes": ["contamination_high", "masking_fallback", "background_cluttered"],
    "source": "real",
    "coverage_report": {
      "num_frames": 44,
      "readable_frames": 40,
      "unique_views": 7,
      "diversity": "sufficient",
      "top_down_captured": false,
      "center_x_span": 0.16,
      "center_y_span": 0.12,
      "scale_variation": 1.22,
      "aspect_variation": 0.15,
      "coverage_score": 0.71,
      "fallback_frames": 22,
      "low_confidence_frames": 14,
      "overall_status": "insufficient",
      "recommended_action": "needs_recapture",
      "reasons": [
        "Too many frames relied on heuristic fallback (22).",
        "Too many frames have low semantic confidence (14)."
      ]
    },
    "validation_report": {
      "final_decision": "fail",
      "contamination_score": 0.64,
      "mobile_performance_grade": "D",
      "poly_count": 32000,
      "component_count": 5,
      "largest_component_share": 0.61
    },
    "notes": "Desk artifacts heavily contaminated model. Coverage heuristic correctly blocked reconstruction.",
    "operator_id": "op_admin",
    "labeled_at": "2026-04-13T00:00:00Z"
  },
  {
    "fixture_id": "real_004",
    "description": "Good studio scan but coverage_score borderline — system passed, operator agrees",
    "session_id": "cap_m3n4o5p6",
    "product_type": "electronics",
    "capture_environment": "studio",
    "label": "good",
    "expected_action": "accept",
    "observed_issue_classes": ["none"],
    "source": "real",
    "coverage_report": {
      "num_frames": 28,
      "readable_frames": 25,
      "unique_views": 5,
      "diversity": "sufficient",
      "top_down_captured": false,
      "center_x_span": 0.12,
      "center_y_span": 0.09,
      "scale_variation": 1.17,
      "aspect_variation": 0.13,
      "coverage_score": 0.61,
      "fallback_frames": 0,
      "low_confidence_frames": 1,
      "overall_status": "sufficient",
      "recommended_action": "reconstruct",
      "reasons": []
    },
    "validation_report": {
      "final_decision": "review",
      "contamination_score": 0.11,
      "mobile_performance_grade": "B",
      "poly_count": 12000,
      "component_count": 1,
      "largest_component_share": 0.97
    },
    "notes": "Borderline coverage but still acceptable. Good test for threshold sensitivity near the boundary."
  },
  {
    "fixture_id": "real_005",
    "description": "Jewelry item — very small subject, high center distance, system correctly passed with low score",
    "session_id": "cap_q7r8s9t0",
    "product_type": "jewelry",
    "capture_environment": "studio",
    "label": "good",
    "expected_action": "accept",
    "observed_issue_classes": ["object_too_small"],
    "source": "real",
    "coverage_report": {
      "num_frames": 60,
      "readable_frames": 55,
      "unique_views": 8,
      "diversity": "sufficient",
      "top_down_captured": true,
      "center_x_span": 0.19,
      "center_y_span": 0.16,
      "scale_variation": 1.38,
      "aspect_variation": 0.18,
      "coverage_score": 0.87,
      "fallback_frames": 2,
      "low_confidence_frames": 3,
      "overall_status": "sufficient",
      "recommended_action": "reconstruct",
      "reasons": []
    },
    "validation_report": {
      "final_decision": "pass",
      "contamination_score": 0.07,
      "mobile_performance_grade": "A",
      "poly_count": 9800,
      "component_count": 1,
      "largest_component_share": 0.99
    },
    "notes": "Small subject. Coverage analyzer handled well. Object-too-small was observed but did not block pipeline."
  },
  {
    "fixture_id": "real_006",
    "description": "FP CASE: Good capture flagged as insufficient due to strict fallback_frames threshold",
    "session_id": "cap_u1v2w3x4",
    "product_type": "sneaker",
    "capture_environment": "studio",
    "label": "good",
    "expected_action": "accept",
    "observed_issue_classes": ["masking_fallback"],
    "source": "real",
    "coverage_report": {
      "num_frames": 42,
      "readable_frames": 40,
      "unique_views": 9,
      "diversity": "sufficient",
      "top_down_captured": true,
      "center_x_span": 0.21,
      "center_y_span": 0.17,
      "scale_variation": 1.35,
      "aspect_variation": 0.19,
      "coverage_score": 0.73,
      "fallback_frames": 22,
      "low_confidence_frames": 3,
      "overall_status": "insufficient",
      "recommended_action": "needs_recapture",
      "reasons": [
        "Too many frames relied on heuristic fallback (22)."
      ]
    },
    "validation_report": {
      "final_decision": "pass",
      "contamination_score": 0.06,
      "mobile_performance_grade": "B",
      "poly_count": 14200,
      "component_count": 1,
      "largest_component_share": 0.98
    },
    "notes": "FALSE POSITIVE: rembg was temporarily unavailable, fallback used but result was actually clean. Suggests fallback_frames threshold is too strict when heuristic fallback produces good masks."
  }
]
